Name_ZH,Name_EN,Title_ZH,Title_EN,Company_ZH,Company_EN,Biography_ZH,Biography_EN,Interview1_ZH,Interview1_EN,Interview2_ZH,Interview2_EN,Interview3_ZH,Interview3_EN,Interview4_ZH,Interview4_EN,ImageURL,LocalImage
Pierre Samaties,Pierre Samaties,CBO,CBO,DFINITY (ICP),DFINITY (ICP),Pierre 是 DFINITY 的首席商务官，该机构是互联网计算机协议（ICP）  的主要贡献者，这一去中心化“云区块链”正瞄准逾 1 万亿美元的云计算市场。互联网计算机可以将应用、网站和企业系统完全部署在链上，提供前所未有的安全性、韧性和去中心化治理，并为“自写云”奠定基础，让 AI 通过自然语言构建与部署应用。他在数字资产、Web3、人工智能和能源领域拥有 20 多年的高管经验；加入 DFINITY 之前，他曾在罗兰贝格担任合伙人兼全球数字资产与 Web3 负责人，并担任德国能源巨头 RWE 中东业务 CEO。自 2014 年起，他就活跃在区块链领域，为政府、主权基金和大型企业就去中心化基础设施提供咨询，担任多家初创企业董事会成员，并管理科技领域的风险投资活动。,"Pierre is the Chief Business Officer at DFINITY, the main contributor to the Internet Computer Protocol (ICP) — a decentralized cloud blockchain pursuing the $1+ trillion cloud market. The Internet Computer hosts applications, websites, and enterprise systems fully on-chain, where they gain unmatched security, resilience, and decentralized administration, and serves as the foundation for a “self-writing cloud” where AI builds and deploys apps through natural language.He is an executive with over 20 years of experience across digital assets, Web3, AI, and the energy sector. Before joining DFINITY, he was Partner and Global Head of Digital Assets & Web3 at Roland Berger and previously served as CEO of RWE’s Middle East operations. Active in blockchain since 2014, he has advised governments, sovereign funds, and blue-chip companies on decentralized infrastructure, served on startup boards, and managed venture investment activities in the technology space.",Pierre Samaties，您在DFINITY (ICP)担任CBO期间，哪一个项目或战略最能体现您当前的关注点？能与我们分享背后的关键洞察吗？,"As the CBO at DFINITY (ICP), which recent project or strategy best captures your current focus, and what insights can you share from it?",你在咨询和风投领域专注 Web3 与能源、AI 等交叉。你怎么看待“去中心化基础设施”在国家级能源和数据项目中的现实落地路径？,"Working at the intersection of Web3, energy, and AI, how do you see decentralized infrastructure realistically fitting into national‑scale energy and data projects?",对政府和主权基金而言，你通常如何设计试点项目，让他们在不承担系统性风险的情况下体验链上基础设施的优势？,"For governments and sovereign funds, how do you structure pilot projects so they can experience on‑chain infra benefits without taking systemic risk?",面向Binance Blockchain Week Dubai的全球观众，您认为2025年Web3/区块链生态中最大的突破机会会出现在何处？,"For the Binance Blockchain Week Dubai audience, where do you see the biggest breakthrough opportunities in the Web3/blockchain ecosystem for 2025?",https://images-eur.cvent.com/pr53/09ea8e8dd03f4676a24755ba47394373/files/event/f9827cbe16f8478abc06f4e8b783ae54/5f9bef7680014236892f4a03e836f448!_!5e38d740c0e3460d4b9fb9499d9bab5e.png?f=webp,avatars/pierre-samaties.png
Qingyuan Zhao,Qingyuan Zhao,"Deputy GM of Public Cloud Business Solution Architect, Head of FinTech Industry Solution Architect","Deputy GM of Public Cloud Business Solution Architect, Head of FinTech Industry Solution Architect",Alibaba Cloud,Alibaba Cloud,现任阿里云公共云解决方案副总经理兼金融科技行业解决方案负责人。自 2016 年加入阿里云以来，他负责多个区域与行业的云计算解决方案业务，主导多家金融科技公司（包括中心化与去中心化交易所、高频交易机构等）的云上架构项目，在高性能、高可用与合规安全等方面拥有丰富实践经验。,"Mr. Qingyuan Zhao is Deputy GM of Public Cloud Business Solution Architect, Head of FinTech Industry Solution Architect at Alibaba Cloud. Since joining Alibaba Cloud in 2016, he has been responsible for cloud computing solution businesses across multiple regions and industries. He has led cloud-based solution projects for a number of fintech companies, including CEX, DEX, HFT etc. He has extensive professional experience in high performance, high availability, and security compliance on the cloud.","Qingyuan Zhao，您在Alibaba Cloud担任Deputy GM of Public Cloud Business Solution Architect, Head of FinTech Industry Solution Architect期间，哪一个项目或战略最能体现您当前的关注点？能与我们分享背后的关键洞察吗？","As the Deputy GM of Public Cloud Business Solution Architect, Head of FinTech Industry Solution Architect at Alibaba Cloud, which recent project or strategy best captures your current focus, and what insights can you share from it?",你在阿里云负责公共云和金融科技解决方案，为 CEX、DEX 和高频机构提供架构。你认为这些客户在上云上链时最容易忽视哪一个“弹性与安全”的平衡点？,"As Deputy GM and Head of FinTech Solutions at Alibaba Cloud, designing architectures for CEXs, DEXs and HFT firms, what trade‑off between elasticity and security do your clients most often overlook?",面对多地区监管与数据本地化要求，你会如何建议一家全球交易平台规划“多云多地域”的基础设施路线图？,"With varying regulations and data‑localization rules, how would you advise a global trading platform to plan a multi‑cloud, multi‑region infrastructure roadmap?",面向Binance Blockchain Week Dubai的全球观众，您认为2025年Web3/区块链生态中最大的突破机会会出现在何处？,"For the Binance Blockchain Week Dubai audience, where do you see the biggest breakthrough opportunities in the Web3/blockchain ecosystem for 2025?",https://images-eur.cvent.com/pr53/09ea8e8dd03f4676a24755ba47394373/files/event/f9827cbe16f8478abc06f4e8b783ae54/bfe792df035347e18c7fa55519a12cab!_!42064fcd0b9f8185e4c7a65ceb1f6410.png?f=webp,avatars/qingyuan-zhao.png
Rachel Wolfson,Rachel Wolfson,Podcast Host & Journalist,Podcast Host & Journalist,Web3 Deep Dive & Cryptonews,Web3 Deep Dive & Cryptonews,Rachel Wolfson 是区块链与 Web3 生态中极具影响力的声音，以深刻的行业洞察与通俗易懂的叙事方式闻名。作为《Web3 Deep Dive》播客主持人，她采访了众多塑造去中心化未来的创始人、开发者、投资人和思想领袖。作为资深记者，Rachel 自 2017 年起开始报道加密货币与区块链，她的作品曾刊登于 Cointelegraph、Forbes、HuffPost、《Bitcoin Magazine》与 Cryptonews.com，擅长将复杂的 Web3 概念拆解给全球受众。,"Rachel Wolfson is a leading voice in the blockchain and Web3 ecosystem, known for her deep industry insight and accessible storytelling. As the host of Web3 Deep Dive podcast, Rachel interviews the pioneers shaping the decentralized future — from founders and developers to investors and thought leaders.A seasoned journalist, Rachel began covering cryptocurrency and blockchain technology in 2017. Her work has been featured in Cointelegraph, Forbes, HuffPost, Bitcoin Magazine, and Cryptonews.com, where she’s known for breaking down complex Web3 concepts for global audiences.",Rachel Wolfson，您在Web3 Deep Dive & Cryptonews担任Podcast Host & Journalist期间，哪一个项目或战略最能体现您当前的关注点？能与我们分享背后的关键洞察吗？,"As the Podcast Host & Journalist at Web3 Deep Dive & Cryptonews, which recent project or strategy best captures your current focus, and what insights can you share from it?",你从 2017 年开始报道区块链和 Web3，一路见证多轮叙事更迭。你如何决定一篇稿子是否值得“花更多版面”去讲底层逻辑，而不是只做快讯？,You’ve covered blockchain and Web3 since 2017 and seen many narratives rise and fall. How do you decide when a story deserves extra space to explain the underlying mechanics instead of just a quick news hit?,你在采访开发者、VC 和监管者时，会刻意问哪一类问题，来帮助普通读者分辨“技术进步”和“市场宣传”的差异？,"When interviewing builders, VCs, and regulators, what type of question do you ask on purpose to help readers distinguish genuine technical progress from pure marketing?",面向Binance Blockchain Week Dubai的全球观众，您认为2025年Web3/区块链生态中最大的突破机会会出现在何处？,"For the Binance Blockchain Week Dubai audience, where do you see the biggest breakthrough opportunities in the Web3/blockchain ecosystem for 2025?",https://images-eur.cvent.com/pr53/09ea8e8dd03f4676a24755ba47394373/files/event/f9827cbe16f8478abc06f4e8b783ae54/d93293ddbf63459dac73fbd762925a1b!_!33a39b6cbdea9c19bf64052dbc5ea5c0.png?f=webp,avatars/rachel-wolfson.png
Rachel Conlan,Rachel Conlan,CMO,CMO,Binance,Binance,Rachel Conlan 是一位具有前瞻视野的市场人与创业战略家。作为 Binance 的首席营销官，她主导公司全球品牌与营销活动，统筹各地区的市场团队。在加入 Binance 之前，她曾担任 OKX 全球品牌营销与合作负责人，在 CAA Sports 负责全球合作伙伴关系，并出任 Havas 的全球首席营销官。,"Rachel Conlan is a visionary marketer and entrepreneurial strategist. As the Chief Marketing Officer at Binance, Rachel is the driving force behind the organization's global marketing and brand campaigns and oversees its regional and marketers across the world. Prior to Binance, Conlan served as Global Head of Brand Marketing and Partnerships at OKX, led Global Partnerships at CAA Sports, a leading international sports and entertainment agency, and served as Global Chief Marketing Officer for Havas.",Rachel Conlan，您在Binance担任CMO期间，哪一个项目或战略最能体现您当前的关注点？能与我们分享背后的关键洞察吗？,"As the CMO at Binance, which recent project or strategy best captures your current focus, and what insights can you share from it?",你在 Binance 统筹全球市场和品牌。面对本地监管和社交平台算法的变化，你如何保证全球品牌“主线故事”仍然清晰一致？,"As CMO of Binance, you oversee global marketing and brand. With shifting regulations and algorithms in each region, how do you maintain a clear, unified brand storyline worldwide?",你曾在 OKX、CAA Sports 和 Havas 服务过体育与娱乐 IP。你认为哪一种体育或文化场景最适合作为“让普通人第一次真正用上 Web3 产品”的入口？,"Having worked at OKX, CAA Sports, and Havas, which sports or cultural scenario do you see as the best entry point for mainstream users to actually use a Web3 product for the first time?",面向Binance Blockchain Week Dubai的全球观众，您认为2025年Web3/区块链生态中最大的突破机会会出现在何处？,"For the Binance Blockchain Week Dubai audience, where do you see the biggest breakthrough opportunities in the Web3/blockchain ecosystem for 2025?",https://images-eur.cvent.com/pr53/09ea8e8dd03f4676a24755ba47394373/files/event/f9827cbe16f8478abc06f4e8b783ae54/340dc96185be4b848b910ae85bb9d535!_!3327776c9d3b6c9a84cbc79e1d788d57.png?f=webp,avatars/rachel-conlan.png
Ran Neuner,Ran Neuner,Founder,Founder,Crypto Banter,Crypto Banter,"Ran Neuner 是 Crypto Banter 的创始人，该平台是全球最大、最具影响力的加密媒体之一，在 YouTube 拥有超过 150 万订阅者、每月 1,000 万以上观看量，并形成业内最具黏性的社区之一，是实时加密内容的核心阵地。Ran 亲自主持全球规模最大的加密直播节目，同时担任 Onchain Capital 的首席执行官，这是一家管理逾 2.5 亿美元风险与二级市场加密资产的区块链投资基金与咨询公司。","Ran Neuner is the founder of Crypto Banter, one of the world’s largest and most influential crypto media platforms. With over 1.5 million YouTube subscribers, 10M+ monthly views, and one of the most engaged communities in the industry, Crypto Banter is a go-to source for real-time crypto content. Ran personally hosts the largest live crypto show on the internet.In addition to his media leadership, Ran is the CEO of Onchain Capital, a blockchain investment fund and advisory firm that manages over $250 million in venture and listed crypto assets.",Ran Neuner，您在Crypto Banter担任Founder期间，哪一个项目或战略最能体现您当前的关注点？能与我们分享背后的关键洞察吗？,"As the Founder at Crypto Banter, which recent project or strategy best captures your current focus, and what insights can you share from it?",你在 Crypto Banter 每天做直播内容，也运营投资基金。你如何在“内容上的观点”和“投资组合的决策”之间建立一套防冲突机制？,"Running daily live shows at Crypto Banter while managing investments, how do you build safeguards between your on‑air opinions and your portfolio decisions to avoid conflicts of interest?",过去几年，你亲眼看到很多散户在极端行情中的情绪波动。如果让你为他们设计一条最简单的“情绪风控规则”，那句规则会怎么写？,"You’ve watched retail emotions swing wildly during extreme markets. If you had to design one simple “emotional risk rule” for them, how would you phrase it?",面向Binance Blockchain Week Dubai的全球观众，您认为2025年Web3/区块链生态中最大的突破机会会出现在何处？,"For the Binance Blockchain Week Dubai audience, where do you see the biggest breakthrough opportunities in the Web3/blockchain ecosystem for 2025?",https://images-eur.cvent.com/pr53/09ea8e8dd03f4676a24755ba47394373/files/event/f9827cbe16f8478abc06f4e8b783ae54/ed2ef2cc33794365a793c298d2654570!_!ffc730c6dc695ab48173ea74e40d8f38.png?f=webp,avatars/ran-neuner.png
Ran Yi,Ran Yi,Co-Founder,Co-Founder,Orderly,Orderly,Ran Yi 是 Orderly 的联合创始人。Orderly 成立于 2022 年，是一套云端流动性基础设施，旨在通过一个无许可、跨链共享的流动性层重塑交易模式。作为 WOO Network 的联合创始人之一，Ran 一直是去中心化金融“普惠化”理念的坚定倡导者。凭借 15 年全球资产管理经验和 5 年加密行业经历，他曾在招商银行、房利美（Freddie Mac）等传统金融机构任职。Ran 毕业于卡内基梅隆大学，获理学学士学位，并在中欧国际工商学院（CEIBS）取得 MBA 学位。,"Ran Yi is the Co-Founder of Orderly. Founded in 2022, Orderly is a cloud liquidity infrastructure designed to revolutionize trading with its permissionless, omnichain liquidity layer. Also a Co-Founder of WOO Network, Ran is a tireless advocate for DeFi’s potential for democratization. With 15 years in global asset management and 5 years in crypto, he has a background in traditional finance, having worked at institutions such as China Merchants Bank and Freddie Mac. Ran holds a Bachelor of Science from Carnegie Mellon University and an MBA from CEIBS.",Ran Yi，您在Orderly担任Co-Founder期间，哪一个项目或战略最能体现您当前的关注点？能与我们分享背后的关键洞察吗？,"As the Co-Founder at Orderly, which recent project or strategy best captures your current focus, and what insights can you share from it?",Orderly 把做市与基础设施结合在一起。你如何向项目方解释，“共享流动性层”会改变他们对产品和代币经济设计的哪些基本假设？,Orderly combines market making with infra. How do you explain to builders which fundamental assumptions about product and token design change when they plug into a shared liquidity layer?,你在资管和银行体系工作多年，如今投身 DeFi。对想从传统金融跳到 Web3 的从业者，你会建议他们优先补哪一块“认知差”？,"Having spent years in asset management and banking before DeFi, what key mindset gap would you urge TradFi professionals to close first when moving into Web3?",面向Binance Blockchain Week Dubai的全球观众，您认为2025年Web3/区块链生态中最大的突破机会会出现在何处？,"For the Binance Blockchain Week Dubai audience, where do you see the biggest breakthrough opportunities in the Web3/blockchain ecosystem for 2025?",https://images-eur.cvent.com/pr53/09ea8e8dd03f4676a24755ba47394373/files/event/f9827cbe16f8478abc06f4e8b783ae54/5063b76873ca490990c07232e8e96791!_!36ec42ff6a1eaf3537d63208dd2cc47f.png?f=webp,avatars/ran-yi.png
Razmik ​,Razmik ​,Binance Angel,Binance Angel,,,自 2023 年起，他成为币安天使，在亚美尼亚及独联体国家开展活动，服务当地社区。,Binance Angels since 2023 in Armenia and CIS countries.,Razmik ​，您在贵团队担任Binance Angel期间，哪一个项目或战略最能体现您当前的关注点？能与我们分享背后的关键洞察吗？,"As the Binance Angel at your team, which recent project or strategy best captures your current focus, and what insights can you share from it?",你在基金或基础设施领域深度参与 Web3。回顾最近一轮周期，你觉得开发者和投资人对哪一种风险的感知最不对称？,"Deeply involved in Web3 funds or infra, in the last cycle which risk do you think developers and investors perceived most asymmetrically?",如果让你为团队写一条“熊市生存守则”，你会强调资金储备、产品聚焦还是团队心态中的哪一点？,"If you had to write a single “bear‑market survival rule” for teams, would you emphasize runway, product focus, or team mindset—and how?",面向Binance Blockchain Week Dubai的全球观众，您认为2025年Web3/区块链生态中最大的突破机会会出现在何处？,"For the Binance Blockchain Week Dubai audience, where do you see the biggest breakthrough opportunities in the Web3/blockchain ecosystem for 2025?",https://images-eur.cvent.com/pr53/09ea8e8dd03f4676a24755ba47394373/files/event/f9827cbe16f8478abc06f4e8b783ae54/1886704d6c1c4ee79996fb7ef75ebbab!_!714310ed935d683f7c0261df1d68e1d0.png?f=webp,avatars/razmik.png
Reece Merrick,Reece Merrick,"Managing Director, Middle East & Africa","Managing Director, Middle East & Africa",Ripple,Ripple,Reece Merrick 是 Ripple 中东及非洲地区常务董事，常驻迪拜，负责公司在该区域的业务运营与战略推进。在此之前，他担任 Ripple 全球战略合作高级总监，主要负责与采用区块链支付和加密流动性解决方案的核心金融机构及加密合作伙伴建立并维护关系，以支持跨境支付。他已在迪拜和伦敦负责 Ripple 支付产品超过五年，在金融科技与支付行业拥有 15 年以上经验，专长于外汇风险管理以及为大型金融机构和企业构建一流跨境支付解决方案。在加入 Ripple 之前，Reece 超过 10 年深耕金融科技与支付领域，聚焦 FX 风险管理和跨境支付系统建设。,"Reece Merrick is the Managing Director of Middle East and Africa at Ripple where he leads the company’s business operations and strategic initiatives from Ripple’s MEA headquarters in Dubai. Prior to his current role, Reece was Senior Director of Global Strategic Partners at Ripple where he led relationships with key financial institutions and crypto partners adopting blockchain-based payments and crypto liquidity solutions to enable cross-border payments. He has spent over half a decade working on Ripple’s payments products across Dubai and London. Reece has over 15 years of experience working within the fintech and payments industry, with expertise focused on foreign exchange risk management and building best-in-class payment solutions for large financial institutions and corporations.Prior to Ripple, Reece spent 10+ years working within the fintech and payments space, focusing on FX risk management and building out cross-border payment solutions for large FIs & corporations.","Reece Merrick，您在Ripple担任Managing Director, Middle East & Africa期间，哪一个项目或战略最能体现您当前的关注点？能与我们分享背后的关键洞察吗？","As the Managing Director, Middle East & Africa at Ripple, which recent project or strategy best captures your current focus, and what insights can you share from it?",你在 Ripple 从合作伙伴到区域负责人，一直专注跨境支付。你认为中东和非洲客户最关心的，不是“区块链”三个字，而是哪一个具体指标？,"From global strategic partnerships to MD for MEA at Ripple, you’ve focused on cross‑border payments. For clients in the Middle East and Africa, what concrete metric do they actually care about more than the word “blockchain”?",回顾你在伦敦和迪拜推动产品落地的经验，你会如何为一个新市场设计“前 3 个试点场景”，既能展示价值又能控制风险？,"Drawing on launches in London and Dubai, how would you design the first three pilot use cases in a new market to showcase value without taking on excessive risk?",面向Binance Blockchain Week Dubai的全球观众，您认为2025年Web3/区块链生态中最大的突破机会会出现在何处？,"For the Binance Blockchain Week Dubai audience, where do you see the biggest breakthrough opportunities in the Web3/blockchain ecosystem for 2025?",https://images-eur.cvent.com/pr53/09ea8e8dd03f4676a24755ba47394373/files/event/f9827cbe16f8478abc06f4e8b783ae54/a2706d2a5d7241a39d8c1900fd89797a!_!37c6aae0cf9d4e0273476c4013714136.png?f=webp,avatars/reece-merrick.png
