Name_ZH,Name_EN,Title_ZH,Title_EN,Company_ZH,Company_EN,Biography_ZH,Biography_EN,Interview1_ZH,Interview1_EN,Interview2_ZH,Interview2_EN,Interview3_ZH,Interview3_EN,ImageURL,LocalImage
Pedro,Pedro,Designer,Designer,Bitcoin Conference,Bitcoin Conference,Pedro 是 Bitcoin Conference 的设计师与开发者，同时深度参与多项无 KYC 开源项目，如 Bisq 和 Mempool。他正在执导纪录片《Anatomy of Bitcoin》，并负责 SatSigner 项目的设计工作，还创立了研究与出版机构 PirateHash，及联合创办闪电网络游戏《Chain Duel》，以多种形式推动比特币文化与基础设施发展。,"Pedro is a designer and developer for the Bitcoin Conference. In addition to extensive contributions to no-KYC open source projects like Bisq and Mempool, he's directing the film Anatomy of Bitcoin, leads the design for the SatSigner project, founded the research and publishing house PirateHash, and co-founded the lighting game Chain Duel.",本次 Bitcoin MENA 之行，您最希望向中东和全球比特币参与者传递的一个核心观点是什么？,"At Bitcoin MENA, what is the single core message you most want to share with bitcoin builders and investors across the region and globally?",结合您在 Bitcoin Conference 的一线经验，过去一年中哪一个具体事件最改变您对比特币或数字资产未来的判断？,"Based on your frontline work at Bitcoin Conference, which concrete event in the last year most changed your outlook on the future of bitcoin or digital assets?",面向 Bitcoin MENA 2025 的观众，您认为未来三年比特币在中东地区最具突破性的应用会出现在何处？,"For the Bitcoin MENA 2025 audience, where do you see the most transformative applications of bitcoin emerging across the Middle East over the next three years?",https://cdn.prod.website-files.com/687f979126432c8ce843e6d7/68f1513332f8cd72d1a4f443_zl_cOSLSwwQsT72Kv8u0XpEmaUKHVS_surzsMnyyOdI.webp,avatars/mena-speakers/pedro.webp
Peter Abou Hachem,Peter Abou Hachem,Head of Growth and Strategy,Head of Growth and Strategy,Hub71,Hub71,Peter 是 Hub71 团队的重要成员，负责战略与产品开发。他主要负责为 Hub71 生态设计新产品与项目，并寻找合适合作伙伴共同落地。其核心工作之一是为初创企业、大公司、政府机构、大学和全球创新中心之间寻找协同效应，通过“配对”与项目嫁接，推动一个完整运转的科技生态系统成型。他参与设计和推出了企业合作计划、风投孵化器、价值创造计划、高校合作、面向初创的银行产品以及“Outliers”等多个重要项目。加入 Hub71 之前，他在罗兰贝格战略咨询担任项目经理，从事科技生态建设、国家级发展战略、新业务孵化、公私合营合作以及数字化转型与重组工作，为如今塑造 Hub71 战略打下坚实基础。Peter 毕业于贝鲁特美国大学土木与环境工程专业，并获得斯坦福大学机器学习证书。,"Peter is a key member of the Hub71 team, leading on Strategy and Product Development.In his current role, Peter plays an integral role in designing new products and programs for the Hub71 ecosystem as well as identifying the right partners that could activate such programs.A key part of Peter’s role is identifying synergies between startups, corporates, government entities, universities, global hubs and programs. Matchmaking entities based on identified synergies is a key role in enabling a fully functional tech ecosystem. Peter has been part of designing and launching programs such as Corporate Engagement Program, Ventures Lab, Value Creation, Academia Engagement, Banking Products for startups, The Outliers and many more.Prior to joining Hub71, Peter was a Project Manager at Roland Berger Strategy Consultants. As a consultant, Peter worked on building tech ecosystems, developing country-wide strategies, building new ventures, driving partnerships between private and public sectors as well as digital transformation and restructuring. This previous experience allows Peter to play a key role in shaping Hub71’s strategy.Peter holds a bachelor’s degree in Civil and Environmental Engineering from the American University of Beirut (Beirut, Lebanon) as well as a Machine Learning certificate from Stanford University (California, USA).",本次 Bitcoin MENA 之行，您最希望向中东和全球比特币参与者传递的一个核心观点是什么？,"At Bitcoin MENA, what is the single core message you most want to share with bitcoin builders and investors across the region and globally?",结合您在 Hub71 的一线经验，过去一年中哪一个具体事件最改变您对比特币或数字资产未来的判断？,"Based on your frontline work at Hub71, which concrete event in the last year most changed your outlook on the future of bitcoin or digital assets?",面向 Bitcoin MENA 2025 的观众，您认为未来三年比特币在中东地区最具突破性的应用会出现在何处？,"For the Bitcoin MENA 2025 audience, where do you see the most transformative applications of bitcoin emerging across the Middle East over the next three years?",https://cdn.prod.website-files.com/687f979126432c8ce843e6d7/6924839470a4b09348a3a573_FDhtSt8Wrm9meNB3ALwruvRoSWoegm9C4w1AASY557U.webp,avatars/mena-speakers/peter-abou-hachem.webp
Peter Duan,Peter Duan,Founder,Founder,Bull Standard,Bull Standard,他曾在传统金融领域工作 14 年，职业经历横跨 Cantor Fitzgerald 结构性融资、美股 500 强企业的投资者关系以及财富管理，如今专注通过新兴的“比特币国库公司”浪潮，在比特币与传统资本市场之间搭建桥梁。,"Ex-TradFi professional with 14 years of experience spanning Structured Finance at Cantor Fitzgerald, Investor Relations for an S&P 500 company, and Wealth Management. Now focused on bridging Bitcoin and traditional capital markets through the emerging Bitcoin Treasury Company movement.",本次 Bitcoin MENA 之行，您最希望向中东和全球比特币参与者传递的一个核心观点是什么？,"At Bitcoin MENA, what is the single core message you most want to share with bitcoin builders and investors across the region and globally?",结合您在 Bull Standard 的一线经验，过去一年中哪一个具体事件最改变您对比特币或数字资产未来的判断？,"Based on your frontline work at Bull Standard, which concrete event in the last year most changed your outlook on the future of bitcoin or digital assets?",面向 Bitcoin MENA 2025 的观众，您认为未来三年比特币在中东地区最具突破性的应用会出现在何处？,"For the Bitcoin MENA 2025 audience, where do you see the most transformative applications of bitcoin emerging across the Middle East over the next three years?",https://cdn.prod.website-files.com/687f979126432c8ce843e6d7/690e084d902e80b9325c12ed_YDzBlxOFyjMFyuVP-VipV7ZJpaikDbpxe-m3jOZCoig.webp,avatars/mena-speakers/peter-duan.webp
Philip Rage,Philip Rage,Head of Underwriting,Head of Underwriting,Soter,Soter,Philip Rage 是一位常驻伦敦的保险高管与数字资产专家，专注加密货币风险管理。他在再保险与保险行业深耕多年，在战略、创新与承保方面累积丰富经验，曾在怡安等机构任职。目前，他担任 Soter Insure 的承保负责人，这家公司专注数字资产保险，通过为比特币托管与 DeFi 提供专门保险产品，将传统金融与加密世界连接起来，使机构能够在受保护的框架下参与比特币业务。,"Philip Rage is a London-based insurance executive and digital assets specialist with a strong focus on cryptocurrency risk management. He has built a career in strategy, innovation, and underwriting within the (re)insurance sector, previously at firms like Aon.Currently Head of Underwriting at Soter Insure, a company specializing in digital asset insurance, Philip bridges traditional finance and crypto by providing coverage for Bitcoin in financial services.His work helps institutionalize Bitcoin custody and DeFi through specialized insurance products, making him a key figure in onboarding traditional capital to the space.",本次 Bitcoin MENA 之行，您最希望向中东和全球比特币参与者传递的一个核心观点是什么？,"At Bitcoin MENA, what is the single core message you most want to share with bitcoin builders and investors across the region and globally?",结合您在 Soter 的一线经验，过去一年中哪一个具体事件最改变您对比特币或数字资产未来的判断？,"Based on your frontline work at Soter, which concrete event in the last year most changed your outlook on the future of bitcoin or digital assets?",面向 Bitcoin MENA 2025 的观众，您认为未来三年比特币在中东地区最具突破性的应用会出现在何处？,"For the Bitcoin MENA 2025 audience, where do you see the most transformative applications of bitcoin emerging across the Middle East over the next three years?",https://cdn.prod.website-files.com/687f979126432c8ce843e6d7/6920ad6f611bd5d386c02376_f38Dr72uqP3FWgu1YAjJQl27djrrg0n7gloiuoqChk0.webp,avatars/mena-speakers/philip-rage.webp
Prince Filip of Serbia,Prince Filip of Serbia,Chief Strategy Officer,Chief Strategy Officer,JAN3,JAN3,塞尔维亚王储菲利普亲王（HRH Hereditary Prince Filip Karađorđević of Serbia）现任金融科技公司 JAN3 的首席战略官（CSO），在加入 JAN3 之前，他在传统金融领域工作 13 年。基于对比特币有望向数十亿人提供金融自由与主权的信念，他选择全职投身该领域。菲利普亲王强烈倡导通过比特币巩固个人财产权与金融自由，并推动有利于无银行账户人群的法律与制度框架。他常在国际会议上演讲，与各国元首、立法者、王室成员、政界人士和企业高管沟通，将比特币视作引领塞尔维亚乃至全球迎来新“文艺复兴”的关键力量。通过其在塞尔维亚设立的基金会，他积极推动基督信仰、文化遗产、金融素养、艺术、科技与家庭价值观。,"HRH Hereditary Prince Filip Karađorđević of Serbia serves as the Chief Strategy Officer (CSO) at JAN3, a global financial technology company. After a 13-year career in traditional finance, Prince Filip joined JAN3, driven by his belief in Bitcoin’s potential to deliver financial freedom and sovereignty to billions worldwide.Prince Filip advocates for strong individual property rights and financial freedom through Bitcoin, while promoting legal frameworks that enable economic empowerment for the unbanked. A frequent guest speaker at prestigious international conferences, he engages with heads of state, legislators, monarchs, politicians, and C-suite executives.Prince Filip envisions a new Renaissance, catalysed by Bitcoin, for Serbia and the wider world. Through his foundation in Serbia, he actively promotes Christianity, cultural heritage, financial literacy, the arts, technology, and family values.",本次 Bitcoin MENA 之行，您最希望向中东和全球比特币参与者传递的一个核心观点是什么？,"At Bitcoin MENA, what is the single core message you most want to share with bitcoin builders and investors across the region and globally?",结合您在 JAN3 的一线经验，过去一年中哪一个具体事件最改变您对比特币或数字资产未来的判断？,"Based on your frontline work at JAN3, which concrete event in the last year most changed your outlook on the future of bitcoin or digital assets?",面向 Bitcoin MENA 2025 的观众，您认为未来三年比特币在中东地区最具突破性的应用会出现在何处？,"For the Bitcoin MENA 2025 audience, where do you see the most transformative applications of bitcoin emerging across the Middle East over the next three years?",https://cdn.prod.website-files.com/687f979126432c8ce843e6d7/68dc3fa1436747db485e13ba_d2240af13deaf50967b197c3.webp,avatars/mena-speakers/prince-filip-of-serbia.webp
Rachel Conlan,Rachel Conlan,CMO,CMO,Binance,Binance,Rachel Conlan 是一位具有远见的市场人和创业战略家，是币安全球市场与品牌活动背后的核心推动力。在币安致力于强化并拓展“全球最值得信赖加密品牌”定位的过程中，她的领导发挥着关键作用。加入币安前，她在 OKX 担任重要领导职务，主导品牌与营销工作，撮合并落地了包括曼城足球俱乐部、迈凯伦车队和翠贝卡电影节在内的一系列高能级国际合作。在此之前，她在国际体育与娱乐经纪巨头 CAA Sports 负责全球合作，通过创新品牌联名与文化营销项目，为全球品牌、版权方与明星之间搭建极具影响力的桥梁。她也曾担任 Havas 全球首席营销官（CMO），领导这家在 Vivendi 旗下、全球第六大传播集团的声誉与营收增长，为多家财富 500 强企业打造综合营销与体验式平台，并在 Havas 内部出任多个领导职位。作为 Havas Luxhub 总经理，她聚焦奢侈品、时尚与生活方式品牌如何触达并留住新一代消费者，其客户包括 LVMH、PUIG、苏富比、Net-a-Porter、NetJets 与 Kit and Ace 等。她还曾担任 Havas 全球增长总监，主导集团全球新业务与营销规划，并参与推动 Havas 在 2012 年从 Euro RSCG Worldwide 品牌重塑为今日 Havas Group 的关键工作。Rachel 目前与丈夫及年幼的儿子居住在阿布扎比。,"Rachel Conlan, a visionary marketer and entrepreneurial strategist is the driving force behind Binance's global marketing and brand campaigns. As Binance embarks on its ambitious journey to reinforce and broaden its standing as the world's most trusted cryptocurrency brand, Rachel's leadership is instrumental. Before joining Binance, Rachel was a transformative figure at OKX, spearheading brand and marketing initiatives that included the negotiation and launch of high-profile international partnerships with Manchester City F.C., McLaren Racing, and Tribeca Festival. Her strategic insights and knack for partnership creation have left indelible marks on the brand. Rachel's vast experience extends to her tenure at CAA Sports, a leading international sports and entertainment agency, where she held the reins of Global Partnerships. She developed innovative brand partnerships and cultural marketing programs, bridging global brands, rights holders, and talent, adding immense value and contributing to CAA's market influence. As the Global Chief Marketing Officer for Havas, the sixth-largest communications company within the Vivendi conglomerate, Rachel demonstrated exceptional leadership. She was entrusted with enhancing Havas' reputation and revenue, crafting integrated marketing and experiential platforms for Fortune 500 companies that set industry benchmarks. In addition to her role as CMO, Rachel's contributions to Havas spanned various leadership positions. As Managing Director of Havas Luxhub, she led strategic and commercial operations, fostering pioneering strategies for luxury, fashion, and lifestyle companies to engage and retain a new generation of consumers. Her client portfolio boasted iconic brands like LVMH, PUIG, Sotheby's, Net-a-Porter, Netjets, and Kit and Ace. Rachel's strategic prowess was further displayed in her role as Havas' Global Growth Director. She orchestrated a comprehensive global new business development and marketing plan for the network. Notably, Rachel was part of the visionary team behind Havas' 2012 rebrand from Euro RSCG Worldwide, establishing a new standard for Havas Group's transformation. Rachel resides in Abu Dhabi, UAE with her husband and toddler son.",本次 Bitcoin MENA 之行，您最希望向中东和全球比特币参与者传递的一个核心观点是什么？,"At Bitcoin MENA, what is the single core message you most want to share with bitcoin builders and investors across the region and globally?",结合您在 Binance 的一线经验，过去一年中哪一个具体事件最改变您对比特币或数字资产未来的判断？,"Based on your frontline work at Binance, which concrete event in the last year most changed your outlook on the future of bitcoin or digital assets?",面向 Bitcoin MENA 2025 的观众，您认为未来三年比特币在中东地区最具突破性的应用会出现在何处？,"For the Bitcoin MENA 2025 audience, where do you see the most transformative applications of bitcoin emerging across the Middle East over the next three years?",https://cdn.prod.website-files.com/687f979126432c8ce843e6d7/6911ffacf8db2ab8eb072a6b_66163cb6f25fdacabda3c745.webp,avatars/mena-speakers/rachel-conlan.webp
Rahim Taghizadegan,Rahim Taghizadegan,CEO,CEO,Deedsats,Deedsats,Rahim Taghizadegan 被誉为“奥地利学派正统传承中的最后一位奥地利经济学家”，在奥地利、瑞士、列支敦士登与德国多所大学授课，著有 15 本以上作品，是首位在大学课堂系统讲授比特币的经济学家。他创立了位于楚格的 scholarium.at，致力于在全球建设“比特币城堡”和教育据点，并创办 deedsats.com，为基于 RGB 与比特币的数字资产构建注重隐私的解决方案。,"Rahim Taghizadegan is the last Austrian economist of the Austrian School in the direct tradition, teaching at universities in Austria, Switzerland, Liechtenstein, and Germany. Author of over 15 books, he was the first economist to teach about Bitcoin at university. He is the founder of scholarium.at, based in Zug, building Bitcoin citadels and educational hubs around the world, and of deedsats.com, building privacy-friendly solutions for digital assets on RGB and Bitcoin.",本次 Bitcoin MENA 之行，您最希望向中东和全球比特币参与者传递的一个核心观点是什么？,"At Bitcoin MENA, what is the single core message you most want to share with bitcoin builders and investors across the region and globally?",结合您在 Deedsats 的一线经验，过去一年中哪一个具体事件最改变您对比特币或数字资产未来的判断？,"Based on your frontline work at Deedsats, which concrete event in the last year most changed your outlook on the future of bitcoin or digital assets?",面向 Bitcoin MENA 2025 的观众，您认为未来三年比特币在中东地区最具突破性的应用会出现在何处？,"For the Bitcoin MENA 2025 audience, where do you see the most transformative applications of bitcoin emerging across the Middle East over the next three years?",https://cdn.prod.website-files.com/687f979126432c8ce843e6d7/6887b638dc64b755698d9ae9_7nft8uflwoyr95y_2ulqj8_lcg2NIIqB9DhK9PGwM74.webp,avatars/mena-speakers/rahim-taghizadegan.webp
Raj⚡ Maitra,Raj⚡ Maitra,CEO,CEO,Bitshala,Bitshala,比特币之前：2016 年毕业于印度理工学院马德拉斯分校结构工程硕士，2016–2021 年期间担任专业结构工程师，参与海上钻井平台、水处理厂、桥梁与地铁高架等工程。2017 年在区块扩容之争末期发现比特币，并迅速沉迷，完全自学货币史、奥地利经济学，以及密码学与数学。随着比特币热情不断加深，他开始学习编程并逐步参与比特币 FOSS 项目开发，2020 年起在 RGB 和 Bitcoin Core 做出早期贡献。他将这段从“Hello World 到 Bitcoin Core”的自学历程记录在博客中。2021 年，他放弃结构工程师职业，全职投入比特币开发，并成为印度首位获得 Spiral 开发者资助的人。从那以后，比特币成为他的人生使命：以一切力所能及的方式为“自由产业”贡献。比特币之后：作为开发者，他 2020–2021 年参与 Bitcoin Core 和 RGB，2021–2023 年在 BDK 团队工作，2023 年起担任 CoinSwap 的核心开发与项目经理。作为社区组织者，他于 2018 年共同创办印度首个“只谈比特币”的 Telegram 社群，2019 年在班加罗尔举办首场比特币 Only 线下聚会，2022 年又先后在果阿发起比特币聚会并承办印度首个比特币 Only 大会的技术议程。作为教育者，他自 2022 年起担任 Summer of Bitcoin 导师，并在 2023 年创立 Bitshala，通过系统教育项目培养新一代比特币开发者，为他们提供学习路径、降低进入 FOSS 的门槛，并通过带薪 Fellowship 计划，帮助他们为真实比特币项目做出专业贡献。,"Pre-Bitcoin:Graduated M.Tech in Structural Engineering in 2016, from IIT Madras.Worked as a professional Structural Engineer for offshore oil rigs, water treatment plants, bridges, and metro viaducts. 2016-2021.Found Bitcoin in 2017 at the dusk of the Blocksize War. Fell in love with the whole idea and started studying deeper. My journey has been entirely self-taught, where I taught myself the history of money, the principles of Austrian economics, and eventually cryptography and maths.Over time the Bitcoin obsession became so big, that I started learning to code. Eventually, I became good enough to start contributing to Bitcoin FOSS projects. Which landed my first part-time gig at RGB and my first little contributions to Bitcoin Core, in 2020.My journey self-studying at that time I documented in this blog: https://www.citadel21.com/from-hello-world-to-bitcoin-coreLeft my structural engineering career completely to work on Bitcoiin full-time by being blessed as the first recipient of the Spiral Dev Grant from India, in 2021.Since then my passion for Bitcoin has led me into an ongoing rabbit hole and it has become my life mission to contribute back to the Freedom Industry, in whatever way best I can.Post Bitcoin:Developer Works:Bitcoin Core Contributor: 2020-2021Developer at RGB: 2020-2021Developer at BDK: 20021-2023Lead Dev and PM in Coiinswap: 2023 onwards.Community Works:Cofounded the first Indian Bitcoin-Only Telegram channel: 2018.Organized the first Bitcoin-Only Meetup in Bangalore: 2019.Organized the first Biitcoiin-Only meetup in Goa: 2022.Organized the Technical Track of the first Bitcoin-Only Conference in India: 2022.Educational Works:Mentor at Summer of Bitcoin: Since 2022Started building Bitshala: 2023.Blogs: https://rajarshi149.medium.com/Bitshala:At Bitshala we organize a package of educational activities to train the upcoming Bitcoin developers. We offer a roadmap to aspiring developers, reducing the barrier to entry in Bitcoiin FOSS, and finally get them started with a paid Felklowshiip Program to start professional contributions to real Biitcoiin FOSS projects.Find more details here: https://bitshala.org/My Twitter: https://x.com/RajarshiMaitraPresentation Description:The presentation will be on Bitshala, explaining its objective, mission, and models.I will brief about all the programs we take up at Bitshala. The roadmap to becoming a Bitcoin development, and how people can start getting involved.I will talk a bit about the FOSS Dev mindset, soft-skills required to be a FOSS dev, and tips on selecting FOSS projects to start contributing.The talk concludes with a concrete roadmap for aspiring developers in the room to start taking Bitcoin FOSS as a viable career alternative.",本次 Bitcoin MENA 之行，您最希望向中东和全球比特币参与者传递的一个核心观点是什么？,"At Bitcoin MENA, what is the single core message you most want to share with bitcoin builders and investors across the region and globally?",结合您在 Bitshala 的一线经验，过去一年中哪一个具体事件最改变您对比特币或数字资产未来的判断？,"Based on your frontline work at Bitshala, which concrete event in the last year most changed your outlook on the future of bitcoin or digital assets?",面向 Bitcoin MENA 2025 的观众，您认为未来三年比特币在中东地区最具突破性的应用会出现在何处？,"For the Bitcoin MENA 2025 audience, where do you see the most transformative applications of bitcoin emerging across the Middle East over the next three years?",https://cdn.prod.website-files.com/687f979126432c8ce843e6d7/691c8553c6e24a0ebc526da9_40bf5445b45ff5652c85a5e7.webp,avatars/mena-speakers/raj-maitra.webp
