Name_ZH,Name_EN,Title_ZH,Title_EN,Company_ZH,Company_EN,Biography_ZH,Biography_EN,Interview1_ZH,Interview1_EN,Interview2_ZH,Interview2_EN,Interview3_ZH,Interview3_EN,Interview4_ZH,Interview4_EN,ImageURL,LocalImage
Itai Elizur,Itai Elizur,Co-Founder & Managing Partner,Co-Founder & Managing Partner,MarketAcross,MarketAcross,"Itai Elizur 是 MarketAcross 的联合创始人兼管理合伙人，同时也是 InboundJunction 和 Chainwire 的合伙人。MarketAcross 是 InboundJunction 集团旗下专注 Web3 的品牌传播机构，曾为超过 300 家区块链企业提供服务，其中包括 Binance、Solana 
、Polygon 、Crypto.com、Polkadot 、Tezos 、Avalanche 、KuCoin 和 eToro 等。Itai 帮助媒体集团、企业级公司及初创企业在数字领域制定并执行 360° 营销与增长战略，曾在 Wix、Infolinks 和 The Forward 担任内容、创意及市场相关职务，也是 BlockBuilders 的天使投资人，并曾在 500Global 特拉维夫办公室担任导师。","Itai Elizur is the Co-Founder and Managing Partner at MarketAcross, and Partner at InboundJunction and Chainwire.MarketAcross is the Web3 branch of the InboundJunction group and has served over 300 blockchain companies, including Binance, Solana, Polygon, Crypto.com, Polkadot, Tezos, Avalanche, Kucoin, and eToro - to name a few.Itai has helped media groups, enterprise companies, and startups develop and execute 360° marketing and growth strategies in the digital space.Itai has worked in content, creative, and marketing roles at Wix, Infolinks, and The Forward. Itai is also an angel investor, investing at BlockBuilders, and was a mentor at 500Global’s Tel Aviv office.",Itai Elizur，您在MarketAcross担任Co-Founder & Managing Partner期间，哪一个项目或战略最能体现您当前的关注点？能与我们分享背后的关键洞察吗？,"As the Co-Founder & Managing Partner at MarketAcross, which recent project or strategy best captures your current focus, and what insights can you share from it?",你在 MarketAcross 等机构为 300+ 区块链项目做过整合营销。回头看，哪一种你曾经以为“必火”的传播玩法实际效果最差？从中学到了什么？,"At MarketAcross and related firms you’ve run campaigns for 300+ blockchain projects. Which marketing playbook you once thought would be a guaranteed hit actually under‑performed, and what did you learn from that?",在当前环境下，如果一个 Web3 项目只能做三件市场动作来支撑“可信度”，你会建议他们优先选择哪三种？,"In today’s market, if a Web3 team can afford only three marketing actions to build credibility, which three would you prioritize?",面向Binance Blockchain Week Dubai的全球观众，您认为2025年Web3/区块链生态中最大的突破机会会出现在何处？,"For the Binance Blockchain Week Dubai audience, where do you see the biggest breakthrough opportunities in the Web3/blockchain ecosystem for 2025?",https://images-eur.cvent.com/pr53/09ea8e8dd03f4676a24755ba47394373/files/event/f9827cbe16f8478abc06f4e8b783ae54/f726f425392547728b67fe01075db117!_!a2ce477a5fe9bbca0c4c93170528bba7.png?f=webp,avatars/itai-elizur.png
Jacob Hanna,Jacob Hanna,Co-Founder and Chief Scientific Advisor,Co-Founder and Chief Scientific Advisor,RenewalBio INC.,RenewalBio INC.,Jacob（Yaqub）Hanna 教授于 2001 年在希伯来大学取得医学科学学士学位，2007 年获免疫学博士和临床医学博士（均为最高荣誉），随后在麻省理工学院从事博士后研究，并于 2011 年加入魏茨曼科学研究院分子遗传学系。Hanna 教授在成人细胞诱导幼稚多能性以及仅依靠干细胞在体外构建类整体胚胎发育模型方面处于世界领先地位。他揭示了重编程过程中的多条新通路，率先获得与小鼠等价的“原始型”人多能干细胞，这些细胞既可构建具有人体组织的跨物种嵌合小鼠模型，也可分化为人类原始生殖细胞（精子或卵子的前体），或形成包括胎盘和卵黄囊在内的全部胚外组织。他首次在“人工子宫”环境中，将哺乳动物胚胎从原肠胚形成前阶段在体外发育延长至晚期器官形成，并据此在培养皿中利用幼稚多能干细胞构建出高度逼真的小鼠和人类整体发育模型。他曾获 Sir Charles Clore 奖（2011）、Rappaport 生物医学研究奖（2013）、Wolf 基金会 Krill 奖（2013）和 Helen & Martin Kimmel 奖（2014），2014 年入选《Cell》“40 岁以下 40 位创新科学家”，2018 年成为 EMBO 会员，2021 年被《Prospect》杂志评为全球 50 位顶尖思想家之首，并于 2025 年因其在幼稚干细胞高保真胚胎模型方面的突破而获得人类前沿科学计划（HFSP）Nakasone 奖。,"Prof. Jacob (Yaqub) Hanna earned his BSc in medical science (2001), PhD in immunology (2007), and MD in clinical medicine summa cum laude (2007) from the Hebrew University. He conducted postdoctoral research at MIT. He joined the department of Molecular Genetics at the Weizmann Institute in 2011.Prof. Hanna is pioneering techniques in induced naïve pluripotency from adult cell and synthetic whole embryo-like developmental models made solely from stem cells ex utero for regenerating new organs and tissues. Induced pluripotent stem (iPS) cells have regenerative properties almost identical to those of embryonic stem cells but can be created from adult cells without using an egg or fetal material. Prof. Hanna has uncovered novel pathways regulating the reprogramming process and was the first to derive pristine “naïve” human pluripotent cells equivalent to those derived from mice and (i) can generate “cross-species humanized chimeric” mouse models that have human derived tissues (ii) can give rise to human primordial germ cell (progenitors of egg or sperm) or (iii) to all extra-embryonic compartments (placenta and yolk-sac). He was the first to expand prolonged periods of advanced and normal mammalian embryo development from pre-gastrulation until late organogenesis in an “artificial uterus” environment outside the maternal womb. The latter platform enabled him to demonstrate the ability to be the first to generate advanced stage & whole stem cell derived developmental models made entirely from naïve pluripotent stem cells in the petri dish in mice and human. He was awarded the Sir Charles Clore Prize (2011), a Rappaport Prize in biomedical research (2013), Krill Prize by the Wolf Foundation (2013), and the Helen and Martin Kimmel Award (2014). In 2014, he was featured among “40 under 40” innovative scientists by Cell journal and became EMBO member in 2018. In 2021, he ranked at the top of the list of 50 leading world thinkers by Prospect magazine. In 2025 he received the Nakasone award by the Human Frontiers Science Program for his groundbreaking work on naïve stem cell derived high fidelity embryo models.",Jacob Hanna，您在RenewalBio INC.担任Co-Founder and Chief Scientific Advisor期间，哪一个项目或战略最能体现您当前的关注点？能与我们分享背后的关键洞察吗？,"As the Co-Founder and Chief Scientific Advisor at RenewalBio INC., which recent project or strategy best captures your current focus, and what insights can you share from it?",你在干细胞与类胚胎模型上有突破性成果。作为科学家，你如何看待区块链和 DeSci 在科研数据共享与知识产权上的潜在作用？,"You’ve made groundbreaking advances in stem cells and embryo‑like models. As a scientist, how do you see blockchain and DeSci helping with data sharing and intellectual property in research?",如果未来真的可以在实验室中大规模“打印器官”，你认为社会在监管和伦理上的最大难题会是什么？这与今天围绕 AI 的担忧有哪些相似之处？,"If we one day mass‑produce organs in the lab, what do you see as the biggest regulatory and ethical challenge, and how does it resemble today’s debates around AI?",面向Binance Blockchain Week Dubai的全球观众，您认为2025年Web3/区块链生态中最大的突破机会会出现在何处？,"For the Binance Blockchain Week Dubai audience, where do you see the biggest breakthrough opportunities in the Web3/blockchain ecosystem for 2025?",https://images-eur.cvent.com/pr53/09ea8e8dd03f4676a24755ba47394373/files/event/f9827cbe16f8478abc06f4e8b783ae54/c3a9791d62f34ca8bd2ce426705ead31!_!7bccf7bc2b359985ae6ac5f95e71b9ba.png?f=webp,avatars/jacob-hanna.png
Jasmine G,Jasmine G,BD Lead,BD Lead,Binance Wallet,Binance Wallet,Jasmine G 自 2023 年起担任 Binance 钱包业务发展负责人。,Jasmine G leads BD at Binance Wallet since 2023,Jasmine G，您在Binance Wallet担任BD Lead期间，哪一个项目或战略最能体现您当前的关注点？能与我们分享背后的关键洞察吗？,"As the BD Lead at Binance Wallet, which recent project or strategy best captures your current focus, and what insights can you share from it?",你从区域法务转到全球钱包 BD，对业务和监管都有深刻理解。你在推进 Binance Wallet 合作时，最常需要向伙伴解释的一个“误区”是什么？,"Moving from regional legal roles to leading BD for Binance Wallet, you bridge business and regulation. In wallet partnerships, what is the single misconception you most often have to clear up for partners?",面对不同国家的监管和支付环境，你会如何为一个新的法币入口或 Web3 功能设定“最低可行合规标准”？,"Across diverse regulatory and payment regimes, how do you define a “minimum viable compliance standard” for launching a new fiat on‑ramp or Web3 feature?",面向Binance Blockchain Week Dubai的全球观众，您认为2025年Web3/区块链生态中最大的突破机会会出现在何处？,"For the Binance Blockchain Week Dubai audience, where do you see the biggest breakthrough opportunities in the Web3/blockchain ecosystem for 2025?",https://images-eur.cvent.com/pr53/09ea8e8dd03f4676a24755ba47394373/files/event/f9827cbe16f8478abc06f4e8b783ae54/b16828b04d714588b26f61dfa0ccd4eb!_!c8f5a2b75c09801c9289e408e76faa35.png?f=webp,avatars/jasmine-g.png
Jason Lim,Jason Lim,Director for Gaming,Director for Gaming,SEI Development Foundation,SEI Development Foundation,Jason Lim 目前在 SEI Development Foundation 负责游戏板块，拥有超过十年游戏行业经验。他擅长通过合作伙伴关系、市场进入策略、用户增长以及品牌和社区建设，帮助合作方扩大市场版图，此前曾在 Immutable Game Studio 与 Bybit 担任关键职位。,"Jason Lim is currently leading the gaming vertical for SEI Development Foundation. With over a decade of experience in the gaming industry. Jason specializes in partnership, go-to market strategies, user acquisition, brand and community building for his partners by leveraging his extensive experience and notable successes in market expansion in his previous roles at Immutable Game Studio and Bybit.",Jason Lim，您在SEI Development Foundation担任Director for Gaming期间，哪一个项目或战略最能体现您当前的关注点？能与我们分享背后的关键洞察吗？,"As the Director for Gaming at SEI Development Foundation, which recent project or strategy best captures your current focus, and what insights can you share from it?",你在 Immutable 和 Bybit 都深度参与游戏业务，如今负责 SEI 的游戏生态。你如何判断一个游戏项目是真的在用区块链增强玩法，而不是简单“加一个 NFT 商城”？,"With experience at Immutable, Bybit, and now leading gaming for SEI, how do you tell if a game is genuinely using blockchain to enhance gameplay rather than just bolting on an NFT shop?",从渠道获取到社区运营，你认为 Web3 游戏团队在 2025 年最应该向传统游戏公司学习的一项技能是什么？,"From user acquisition to community ops, what is the one capability Web3 game teams should learn from traditional studios in 2025?",面向Binance Blockchain Week Dubai的全球观众，您认为2025年Web3/区块链生态中最大的突破机会会出现在何处？,"For the Binance Blockchain Week Dubai audience, where do you see the biggest breakthrough opportunities in the Web3/blockchain ecosystem for 2025?",https://images-eur.cvent.com/pr53/09ea8e8dd03f4676a24755ba47394373/files/event/f9827cbe16f8478abc06f4e8b783ae54/a7059d1c40eb4864ba51daac5f9b4f53!_!9ad8d4010e3448a3cbcd2913fa9720bb.png?f=webp,avatars/jason-lim.png
Jeff Liu,Jeff Liu,CEO,CEO,Solayer,Solayer,Jeff Liu 是 Solayer 的首席执行官兼 Fuzzland 联合创始人，带领团队开发全球首个硬件加速区块链 InfiniSVM。凭借超过 20 年企业软件经验，他多次从零到一建设并领导跨行业产品团队。Jeff 的职业生涯始于 Siebel Systems（后被 Oracle 以 50 亿美元收购），随后成为 VMware 核心基础设施团队早期成员；2012 年，他共同创立 LBS 社交数据聚合平台 Portaura，后被阿里巴巴收购，并担任 Veridise 首席运营官。他拥有卡内基梅隆大学工商管理学位以及上海交通大学计算机工程学位。,"Jeff Liu is the CEO of Solayer and Co-Founder of Fuzzland, leading the development of InfiniSVM — the world’s first hardware-accelerated blockchain. With more than 20 years of experience in enterprise software, he has built and led product teams from 0 to 1 across multiple industries. Jeff began his career at Siebel Systems (acquired by Oracle for $5B) and was an early member of VMware’s Core Infrastructure team. In 2012, he co-founded Portaura, an LBS social data aggregation platform later acquired by Alibaba, and served as COO of Veridise. He holds degrees in Business Management from Carnegie Mellon University and Computer Engineering from Shanghai Jiao Tong University.",Jeff Liu，您在Solayer担任CEO期间，哪一个项目或战略最能体现您当前的关注点？能与我们分享背后的关键洞察吗？,"As the CEO at Solayer, which recent project or strategy best captures your current focus, and what insights can you share from it?",你在企业软件和底层基础设施领域工作了 20 多年，如今在 Solayer 做硬件加速区块链。你觉得当前公链讨论中，哪一个关于“性能瓶颈”的说法最被夸大？,"With 20+ years in enterprise software and infra, now building a hardware‑accelerated chain at Solayer, which common statement about “performance bottlenecks” in L1s do you think is most exaggerated?",从 Siebel、VMware 到被阿里收购的创业公司，你多次见证技术栈更迭。对今天的 Web3 创业者而言，你会如何建议他们为“未来还没出现的硬件与云架构”预留弹性？,"From Siebel and VMware to exits like the sale to Alibaba, you’ve seen many stack transitions. How would you advise Web3 founders to future‑proof their architecture for hardware and cloud changes that haven’t arrived yet?",面向Binance Blockchain Week Dubai的全球观众，您认为2025年Web3/区块链生态中最大的突破机会会出现在何处？,"For the Binance Blockchain Week Dubai audience, where do you see the biggest breakthrough opportunities in the Web3/blockchain ecosystem for 2025?",https://images-eur.cvent.com/pr53/09ea8e8dd03f4676a24755ba47394373/files/event/f9827cbe16f8478abc06f4e8b783ae54/571170e98be844a9a341c4ec9a9a4d20!_!89cbcbd23da73290d57e248f5f67589b.png?f=webp,avatars/jeff-liu.png
Jess Houlgrave,Jess Houlgrave,CEO,CEO,WalletConnect,WalletConnect,Jess 是 WalletConnect 的首席执行官，该公司是金融互联网的连接层。此前，她在全球金融科技公司 Checkout.com 负责加密业务，并曾是英国央行 CBDC 参与论坛成员，以及 UK Finance 新型数字货币指导小组、Innovate Finance 金融科技战略小组和英国国际贸易部金融科技小组的成员。,"Jess is the CEO of WalletConnect, the connective layer for the financial internet. Previously she led Crypto at Checkout.com, a global fintech company. Jess was also a member of the Bank of England CBDC Engagement Forum and a member of UK Finance New Digital Money Steering Group, Innovate Finance Fintech Strategy Group and Department for International Trade Fintech Group",Jess Houlgrave，您在WalletConnect担任CEO期间，哪一个项目或战略最能体现您当前的关注点？能与我们分享背后的关键洞察吗？,"As the CEO at WalletConnect, which recent project or strategy best captures your current focus, and what insights can you share from it?",你从传统金融到 NFT 与支付，再到 WalletConnect CEO。你如何理解“数字所有权”在 2025 年普通用户日常生活中的真实价值，而不仅仅是收藏和头像？,"From TradFi to NFTs, payments, and now CEO of WalletConnect, how do you define the real, everyday value of “digital ownership” for mainstream users in 2025 beyond collectibles and profile pictures?",作为连接层公司负责人，你对“多链未来”的看法有什么变化？你现在更看重的是链之间的资产桥，还是身份与权限的互通？,"As the leader of a connectivity layer, how has your view of a “multi‑chain future” evolved—do you now prioritize asset bridges between chains, or interoperability of identity and permissions?",面向Binance Blockchain Week Dubai的全球观众，您认为2025年Web3/区块链生态中最大的突破机会会出现在何处？,"For the Binance Blockchain Week Dubai audience, where do you see the biggest breakthrough opportunities in the Web3/blockchain ecosystem for 2025?",https://images-eur.cvent.com/pr53/09ea8e8dd03f4676a24755ba47394373/files/event/f9827cbe16f8478abc06f4e8b783ae54/249ba12aca814dc7b12aa12541d85619!_!523ba9189ff605272a236d379e8547ab.png?f=webp,avatars/jess-houlgrave.png
Joey Awwad,Joey Awwad,Binance Angel,Binance Angel,,,这位来自 MENA 地区的营养师转型为 Binance 志愿者（Binance Angel），负责当地社区的支持与教育工作。,Dietitian turned Binance Angel – MENA Region,Joey Awwad，您在贵团队担任Binance Angel期间，哪一个项目或战略最能体现您当前的关注点？能与我们分享背后的关键洞察吗？,"As the Binance Angel at your team, which recent project or strategy best captures your current focus, and what insights can you share from it?",你在中东创投和加密生态中扮演重要角色。对本地创业者来说，你认为在融资路演中最容易忽略、却最能打动国际投资人的一部分故事是什么？,"You play a key role in the Middle Eastern VC and crypto ecosystem. For local founders, what part of their story do they most often overlook in fundraising, even though it could most impress global investors?",从投后管理角度看，你最希望 Web3 创始团队在治理结构或信息披露上提前做好哪一件事，以避免后期复杂的股权与代币纠纷？,"From a post‑investment viewpoint, what governance or disclosure step do you wish Web3 teams would put in place early to avoid messy equity and token disputes later?",面向Binance Blockchain Week Dubai的全球观众，您认为2025年Web3/区块链生态中最大的突破机会会出现在何处？,"For the Binance Blockchain Week Dubai audience, where do you see the biggest breakthrough opportunities in the Web3/blockchain ecosystem for 2025?",https://images-eur.cvent.com/pr53/09ea8e8dd03f4676a24755ba47394373/files/event/f9827cbe16f8478abc06f4e8b783ae54/0feeda687ed24a39a2592f0f65ced0ee!_!f8eda5fe462ef211b9e07e6f41dd8443.png?f=webp,avatars/joey-awwad.png
Johann Eid,Johann Eid,Chief Business Officer,Chief Business Officer,Chainlink Labs,Chainlink Labs,作为首席商务官，Johann 负责协调所有希望基于 Chainlink  构建的开发者和协议的接入流程。采用 Chainlink 的项目覆盖 DeFi、NFT、游戏、保险等广泛的去中心化应用领域；自 2019 年以来，他即参与使用 Chainlink 推动 DeFi 发展的进程，与 Aave、Synthetix 等现已成为行业领军者的协议密切合作。他坚信区块链与混合智能合约将重塑现代金融体系以及人类与之互动的方式。,"As Chief Business Officer, Johann oversees the integration process for developers and protocols looking to build with Chainlink. Projects implementing Chainlink span a vast array of decentralized applications, including decentralized finance (DeFi), NFTs, gaming, insurance, and more. Johann has been involved in shaping the DeFi space through the use of Chainlink since its inception in 2019, when he worked with now-leading DeFi protocols like Aave and Synthetix. He is a firm believer that blockchain technology and hybrid smart contracts are set to revolutionize modern financial systems and our relationships with them.",Johann Eid，您在Chainlink Labs担任Chief Business Officer期间，哪一个项目或战略最能体现您当前的关注点？能与我们分享背后的关键洞察吗？,"As the Chief Business Officer at Chainlink Labs, which recent project or strategy best captures your current focus, and what insights can you share from it?",你在 Chainlink 负责商务和生态拓展，从 DeFi 到 RWA 都在用预言机。站在今天，你觉得哪个新领域会成为预言机需求的“下一条 S 曲线”？,"As Chief Business Officer at Chainlink, you’ve seen oracles power everything from DeFi to RWAs. From today’s vantage point, which new vertical do you think will generate the next S‑curve of oracle demand?",当你和机构客户讨论混合智能合约时，你会用什么样的真实案例证明：链上与链下数据结合能创造传统系统完全做不到的东西？,"When talking to institutions about hybrid smart contracts, what real‑world example do you use to show that combining on‑ and off‑chain data enables something legacy systems simply cannot do?",面向Binance Blockchain Week Dubai的全球观众，您认为2025年Web3/区块链生态中最大的突破机会会出现在何处？,"For the Binance Blockchain Week Dubai audience, where do you see the biggest breakthrough opportunities in the Web3/blockchain ecosystem for 2025?",https://images-eur.cvent.com/pr53/09ea8e8dd03f4676a24755ba47394373/files/event/f9827cbe16f8478abc06f4e8b783ae54/7fb469bc194642a8adb237812f70e1e9!_!500c09b1d723c793eeae633ef8f7a1fb.png?f=webp,avatars/johann-eid.png
Jon Rice,Jon Rice,Editor-in-Chief,Editor-in-Chief,Cointelegraph,Cointelegraph,暂无中文介绍（可在 CSV 中补充）,,Jon Rice，您在Cointelegraph担任Editor-in-Chief期间，哪一个项目或战略最能体现您当前的关注点？能与我们分享背后的关键洞察吗？,"As the Editor-in-Chief at Cointelegraph, which recent project or strategy best captures your current focus, and what insights can you share from it?",你在多家加密媒体担任编辑和创始人。你如何在新闻编辑室里建立一套机制，既能快速跟进热点，又能防止“为流量牺牲事实”？,"Having led and founded several crypto media outlets, how do you design newsroom processes that allow rapid coverage of breaking stories without sacrificing accuracy for clicks?",站在媒体人的角度，你认为 Web3 项目在面向公众沟通时最应该抛弃的一种旧互联网 PR 心态是什么？,"From a media perspective, what old‑internet PR mindset should Web3 projects abandon first when they communicate with the public?",面向Binance Blockchain Week Dubai的全球观众，您认为2025年Web3/区块链生态中最大的突破机会会出现在何处？,"For the Binance Blockchain Week Dubai audience, where do you see the biggest breakthrough opportunities in the Web3/blockchain ecosystem for 2025?",,assets/default-avatar.svg
