Name_ZH,Name_EN,Title_ZH,Title_EN,Company_ZH,Company_EN,Biography_ZH,Biography_EN,Interview1_ZH,Interview1_EN,Interview2_ZH,Interview2_EN,Interview3_ZH,Interview3_EN,ImageURL,LocalImage
Bill Qian,Bill Qian,Founder,Founder,Cypher Capital,Cypher Capital,"Bill Qian 是全球知名的投资人、企业家和思想领袖，长期布局加密、人工智能和金融科技等前沿领域，累计投资规模超过 300 亿美元，助推多项颠覆性技术在全球落地。目前，他是 Cypher Capital 的联合创始人，这是一家专注区块链和 Web3 的多策略投资机构。此前，他曾担任币安的全球并购与 Binance Labs 负责人，管理过规模高达 250 亿美元的全球最大加密投资组合，并在京东负责金融科技和 AI 投资，服务的业务年 GMV 超过 4000 亿美元。除投资外，Bill 也积极倡导 AI、区块链和数字金融的融合，他通过播客《Where AI Meets Crypto, Technology Meets Humanity, and East Meets West》与全球顶级行业嘉宾探讨最新趋势。","Bill Qian – Founder, Investor, & Thought LeaderBill Qian is a global investor, entrepreneur, and thought leader shaping the future of crypto, AI, and fintech. With a track record of over $30 billion in investments, he has played a key role in backing and scaling transformative technologies worldwide.Currently, Bill is the Co-Founder of Cypher Capital, a leading multi-strategy investment firm focused on blockchain and Web3.Previously, Bill was the Global Head of M&A and Binance Labs at Binance, where he managed the world's largest crypto investment portfolio at the time—$25 billion. Prior to that, he led fintech and AI investments at JD.com, overseeing investments in a business that generated over $400 billion in gross merchandise volume (GMV).Beyond investing, Bill is a passionate advocate for the convergence of AI, blockchain, and digital finance. He shares insights through his podcast, “Where AI Meets Crypto, Technology Meets Humanity, and East Meets West,” featuring top industry voices on emerging trends.",本次 Bitcoin MENA 之行，您最希望向中东和全球比特币参与者传递的一个核心观点是什么？,"At Bitcoin MENA, what is the single core message you most want to share with bitcoin builders and investors across the region and globally?",结合您在 Cypher Capital 的一线经验，过去一年中哪一个具体事件最改变您对比特币或数字资产未来的判断？,"Based on your frontline work at Cypher Capital, which concrete event in the last year most changed your outlook on the future of bitcoin or digital assets?",面向 Bitcoin MENA 2025 的观众，您认为未来三年比特币在中东地区最具突破性的应用会出现在何处？,"For the Bitcoin MENA 2025 audience, where do you see the most transformative applications of bitcoin emerging across the Middle East over the next three years?",https://cdn.prod.website-files.com/687f979126432c8ce843e6d7/6920ad6a77208e786f90fb3e_YRzCSiYweZKGMXTFv5ulKgTecXBcP3iIkKVEsCUrdvE.webp,avatars/mena-speakers/bill-qian.webp
Billy Boone,Billy Boone,Director of Market Research,Director of Market Research,Simple Mining,Simple Mining,在 Simple Mining 负责市场研究，同时也是《Bitcoin Mining Investor Letter》（比特币挖矿投资者通讯）的创始人。,Market Research at Simple Mining. Founder of The Bitcoin Mining Investor Letter.,本次 Bitcoin MENA 之行，您最希望向中东和全球比特币参与者传递的一个核心观点是什么？,"At Bitcoin MENA, what is the single core message you most want to share with bitcoin builders and investors across the region and globally?",结合您在 Simple Mining 的一线经验，过去一年中哪一个具体事件最改变您对比特币或数字资产未来的判断？,"Based on your frontline work at Simple Mining, which concrete event in the last year most changed your outlook on the future of bitcoin or digital assets?",面向 Bitcoin MENA 2025 的观众，您认为未来三年比特币在中东地区最具突破性的应用会出现在何处？,"For the Bitcoin MENA 2025 audience, where do you see the most transformative applications of bitcoin emerging across the Middle East over the next three years?",https://cdn.prod.website-files.com/687f979126432c8ce843e6d7/691d2b692ef36fc4fdccc766_0a12eeb3fe689895288fcc94.webp,avatars/mena-speakers/billy-boone.webp
Borja Martel Seward,Borja Martel Seward,Co-Founder & CEO,Co-Founder & CEO,Roxom,Roxom,正在打造“比特币版华尔街”，致力于构建围绕比特币的完整金融基础设施。,Building Bitcoin's Wall Street,本次 Bitcoin MENA 之行，您最希望向中东和全球比特币参与者传递的一个核心观点是什么？,"At Bitcoin MENA, what is the single core message you most want to share with bitcoin builders and investors across the region and globally?",结合您在 Roxom 的一线经验，过去一年中哪一个具体事件最改变您对比特币或数字资产未来的判断？,"Based on your frontline work at Roxom, which concrete event in the last year most changed your outlook on the future of bitcoin or digital assets?",面向 Bitcoin MENA 2025 的观众，您认为未来三年比特币在中东地区最具突破性的应用会出现在何处？,"For the Bitcoin MENA 2025 audience, where do you see the most transformative applications of bitcoin emerging across the Middle East over the next three years?",https://cdn.prod.website-files.com/687f979126432c8ce843e6d7/68f1511fc1b8c54b78b4b475_iRv1iMGsyiukT6Sijn61dGTd9UFCfS0-yEQ_NHSGSkM.webp,avatars/mena-speakers/borja-martel-seward.webp
Brandon Green,Brandon Green,CEO,CEO,BTC Inc,BTC Inc,Brandon 是 BTC Inc. 的 CEO，自 2017 年加入以来，他在公司担任过总经理、幕僚长和活动负责人等关键职务，帮助比特币大会品牌从美国扩展到阿姆斯特丹、香港和阿布扎比等全球城市。,"Brandon is CEO of BTC Inc. Since joining the Company in 2017, Green has been a core member of BTC Inc, holding a variety of leadership roles including Managing Director, Chief of Staff, and Head of Events. During his tenure, he has helped drive the global expansion of the Bitcoin Conference franchise beyond the United States to Amsterdam, Hong Kong, and Abu Dhabi.",本次 Bitcoin MENA 之行，您最希望向中东和全球比特币参与者传递的一个核心观点是什么？,"At Bitcoin MENA, what is the single core message you most want to share with bitcoin builders and investors across the region and globally?",结合您在 BTC Inc 的一线经验，过去一年中哪一个具体事件最改变您对比特币或数字资产未来的判断？,"Based on your frontline work at BTC Inc, which concrete event in the last year most changed your outlook on the future of bitcoin or digital assets?",面向 Bitcoin MENA 2025 的观众，您认为未来三年比特币在中东地区最具突破性的应用会出现在何处？,"For the Bitcoin MENA 2025 audience, where do you see the most transformative applications of bitcoin emerging across the Middle East over the next three years?",https://cdn.prod.website-files.com/687f979126432c8ce843e6d7/691e1280b042276097b785ce_bXYbqJ6tPtYHXXLjRx3vpKvHiDZz4AUnP4u0HAgKRKs.webp,avatars/mena-speakers/brandon-green.webp
Brett Tejpaul,Brett Tejpaul,Co-CEO Institutional,Co-CEO Institutional,Coinbase,Coinbase,Brett Tejpaul 是 Coinbase Institutional 的联席 CEO，带领团队为机构投资者打造值得信赖的加密桥梁，在托管、专业交易与综合服务等方面开拓产品与功能，推动全球机构采用数字资产。他曾在巴克莱担任全球销售主管，并在摩根大通担任高级管理职务，兼具传统金融市场与加密创新经验，拥有波士顿学院理学学士学位。,"Brett Tejpaul serves as Co-CEO of Coinbase Institutional, leading Coinbase’s efforts to build a trusted bridge for institutions expanding their crypto strategies. In this role, he spearheads the growth of the institutional client base, develops sophisticated features and services tailored to institutional investors, and drives industry-wide education and innovation on digital assets.Brett brings deep expertise from traditional finance, having previously served as Global Head of Sales at Barclays and held senior leadership positions at JP Morgan. His unique combination of institutional markets experience and global crypto innovation enables him to deliver integrated solutions that seamlessly connect custody, advanced trading platforms, and prime services for the world's leading institutions.Brett holds a Bachelor of Science degree from Boston College.",本次 Bitcoin MENA 之行，您最希望向中东和全球比特币参与者传递的一个核心观点是什么？,"At Bitcoin MENA, what is the single core message you most want to share with bitcoin builders and investors across the region and globally?",结合您在 Coinbase 的一线经验，过去一年中哪一个具体事件最改变您对比特币或数字资产未来的判断？,"Based on your frontline work at Coinbase, which concrete event in the last year most changed your outlook on the future of bitcoin or digital assets?",面向 Bitcoin MENA 2025 的观众，您认为未来三年比特币在中东地区最具突破性的应用会出现在何处？,"For the Bitcoin MENA 2025 audience, where do you see the most transformative applications of bitcoin emerging across the Middle East over the next three years?",https://cdn.prod.website-files.com/687f979126432c8ce843e6d7/6921aedca4930d6e65a896e3_a9c6c5684b827ed09f14e76d.webp,avatars/mena-speakers/brett-tejpaul.webp
Brian Dixon,Brian Dixon,CEO,CEO,Off the Chain Capital,Off the Chain Capital,Brian 是 Off the Chain Capital 的 CEO，这是一家采用“巴菲特式价值投资”策略、专注折价收购区块链资产的基金。他自 2012 年进入比特币领域，著有四本关于比特币和前沿科技的书，并走访世界各地宣讲比特币技术与资产的重要性。,"Brian is the CEO of Off the Chain Capital, which is a Warren Buffet value-style investment firm focused on acquiring blockchain assets at a discount. He is the author of four books covering Bitcoin and advanced technology. He entered the Bitcoin space in 2012 and has traveled the world educating people on the importance of the technology and asset.",本次 Bitcoin MENA 之行，您最希望向中东和全球比特币参与者传递的一个核心观点是什么？,"At Bitcoin MENA, what is the single core message you most want to share with bitcoin builders and investors across the region and globally?",结合您在 Off the Chain Capital 的一线经验，过去一年中哪一个具体事件最改变您对比特币或数字资产未来的判断？,"Based on your frontline work at Off the Chain Capital, which concrete event in the last year most changed your outlook on the future of bitcoin or digital assets?",面向 Bitcoin MENA 2025 的观众，您认为未来三年比特币在中东地区最具突破性的应用会出现在何处？,"For the Bitcoin MENA 2025 audience, where do you see the most transformative applications of bitcoin emerging across the Middle East over the next three years?",https://cdn.prod.website-files.com/687f979126432c8ce843e6d7/6883c8f5debeb5d0904d61b2_Zrd18ezLkqOc7Fytrgj31JeZ1q2syDVd-Sp4s2sZFvQ.webp,avatars/mena-speakers/brian-dixon.webp
Brindon Mwiine,Brindon Mwiine,Founder,Founder,Bitcoin Kampala/Gorilla Sats,Bitcoin Kampala/Gorilla Sats,Brindon Mwiine 是 Bitcoin Kampala Uganda 的创始人，通过比特币教育、循环经济实践以及用聪支付教师薪资，推动比特币在乌干达的真实落地。他还是 Gorilla Sats 的联合创始人，将比特币与乌干达的探险旅游结合起来。,"Brindon Mwiine is the Founder of Bitcoin Kampala Uganda, driving real-world Bitcoin adoption in Uganda through Bitcoin education, circular-economy initiatives, and paying teachers in sats. He is also Co-Founder of Gorilla Sats, which fuses Bitcoin with adventure tourism across Uganda.",本次 Bitcoin MENA 之行，您最希望向中东和全球比特币参与者传递的一个核心观点是什么？,"At Bitcoin MENA, what is the single core message you most want to share with bitcoin builders and investors across the region and globally?",结合您在 Bitcoin Kampala/Gorilla Sats 的一线经验，过去一年中哪一个具体事件最改变您对比特币或数字资产未来的判断？,"Based on your frontline work at Bitcoin Kampala/Gorilla Sats, which concrete event in the last year most changed your outlook on the future of bitcoin or digital assets?",面向 Bitcoin MENA 2025 的观众，您认为未来三年比特币在中东地区最具突破性的应用会出现在何处？,"For the Bitcoin MENA 2025 audience, where do you see the most transformative applications of bitcoin emerging across the Middle East over the next three years?",https://cdn.prod.website-files.com/687f979126432c8ce843e6d7/68eea66ebf8c5d21bce9cb3b_7978bd7ec5a6a4e0bd90766c.webp,avatars/mena-speakers/brindon-mwiine.webp
Bruce Fenton,Bruce Fenton,CEO,CEO,Chainstone Labs,Chainstone Labs,Bruce 是投资控股公司 Chainstone Labs 的 CEO，自 2013 年起全职投身比特币，当时曾担任比特币基金会执行董事，拥有超过 30 年金融与投资经验，也是注册投资顾问公司 Atlantic Financial 的拥有者。他是自由与自由市场的积极倡导者，曾在 2022 年竞选新罕布什尔州联邦参议员，并已连续 12 年主办 Satoshi Roundtable 闭门圆桌，汇聚比特币与金融科技生态中的创始人、CEO 与核心开发者。,"Bruce is CEO of the investment holding company Chainstone Labs. Bruce has been full time in Bitcoin since 2013 when he was Executive Director of the Bitcoin Foundation. He has over 30 years financial and investing experience and owns Atlantic Financial, a Registered Investment Advisor. Fenton is a liberty and free market advocate and ran for US Senate for New Hampshire in 2022. Fenton is the host of the Satoshi Roundtable, now in its 12th year, an annual event bringing together leading Founders, CEOs, and developers in the fintech and Bitcoin ecosystem.",本次 Bitcoin MENA 之行，您最希望向中东和全球比特币参与者传递的一个核心观点是什么？,"At Bitcoin MENA, what is the single core message you most want to share with bitcoin builders and investors across the region and globally?",结合您在 Chainstone Labs 的一线经验，过去一年中哪一个具体事件最改变您对比特币或数字资产未来的判断？,"Based on your frontline work at Chainstone Labs, which concrete event in the last year most changed your outlook on the future of bitcoin or digital assets?",面向 Bitcoin MENA 2025 的观众，您认为未来三年比特币在中东地区最具突破性的应用会出现在何处？,"For the Bitcoin MENA 2025 audience, where do you see the most transformative applications of bitcoin emerging across the Middle East over the next three years?",https://cdn.prod.website-files.com/687f979126432c8ce843e6d7/68e69a91e189cd2254549fa8__6na6voHfDiqe6smXQ7s7f7BrF-FpTFD3E1f9IpuFg0.webp,avatars/mena-speakers/bruce-fenton.webp
Carl Moon,Carl Moon,CEO & Founder,CEO & Founder,Moon Group,Moon Group,Carl Runefelt 是知名的比特币最大主义者和企业家，凭借媒体影响力、投资布局和在加密领域的领导地位，致力于推动比特币的大规模采用，并鼓励他人以长期信念将比特币视作新金融时代的基石。,"Carl Runefelt is a prominent Bitcoin maximalist and entrepreneur who through his media presence, investments, and leadership in the crypto space - Promotes widespread Bitcoin adoption while encouraging others to adopt a long-term, conviction in Bitcoin as the foundation of the new financial era.",本次 Bitcoin MENA 之行，您最希望向中东和全球比特币参与者传递的一个核心观点是什么？,"At Bitcoin MENA, what is the single core message you most want to share with bitcoin builders and investors across the region and globally?",结合您在 Moon Group 的一线经验，过去一年中哪一个具体事件最改变您对比特币或数字资产未来的判断？,"Based on your frontline work at Moon Group, which concrete event in the last year most changed your outlook on the future of bitcoin or digital assets?",面向 Bitcoin MENA 2025 的观众，您认为未来三年比特币在中东地区最具突破性的应用会出现在何处？,"For the Bitcoin MENA 2025 audience, where do you see the most transformative applications of bitcoin emerging across the Middle East over the next three years?",https://cdn.prod.website-files.com/687f979126432c8ce843e6d7/6900c3dc4c952e8b9ad8d9d0_ca8c61e5006154eb5e53891a.webp,avatars/mena-speakers/carl-moon.webp
Carlos Estrada,Carlos Estrada,CEO & Founder,CEO & Founder,Coin Vigilante,Coin Vigilante,Carlos Estrada 是比特币企业家，创立了 Coin Vigilante，制作限量版比特币主题腕表，将“稀缺性、精密度和工作量证明”融入产品；他同时创立 Vigilante Media，为品牌提供全案营销与叙事策略，并领导 Venture Watches，在全球范围内为品牌和机构提供 B2B 腕表设计与生产服务。他的工作连接比特币、工艺与创业精神，强调健全货币、创造力与长期价值。,"Carlos Estrada is a Bitcoin entrepreneur and the founder of Coin Vigilante, a company creating limited-edition Bitcoin-inspired timepieces that embody scarcity, precision, and proof-of-work. He is also the founder of Vigilante Media, a full-service marketing agency helping brands grow through storytelling, creative strategy, and digital innovation. In addition, Carlos leads Venture Watches, a B2B watch manufacturing company that provides end-to-end design and production solutions for brands and organizations worldwide. His work connects the worlds of Bitcoin, craftsmanship, and entrepreneurship—driven by a belief in sound money, creativity, and building lasting value.",本次 Bitcoin MENA 之行，您最希望向中东和全球比特币参与者传递的一个核心观点是什么？,"At Bitcoin MENA, what is the single core message you most want to share with bitcoin builders and investors across the region and globally?",结合您在 Coin Vigilante 的一线经验，过去一年中哪一个具体事件最改变您对比特币或数字资产未来的判断？,"Based on your frontline work at Coin Vigilante, which concrete event in the last year most changed your outlook on the future of bitcoin or digital assets?",面向 Bitcoin MENA 2025 的观众，您认为未来三年比特币在中东地区最具突破性的应用会出现在何处？,"For the Bitcoin MENA 2025 audience, where do you see the most transformative applications of bitcoin emerging across the Middle East over the next three years?",https://cdn.prod.website-files.com/687f979126432c8ce843e6d7/68f921e6241b6b69e7c17ce8_f493850c132d15cbad340023.webp,avatars/mena-speakers/carlos-estrada.webp
Carly B,Carly B,Head of VIP & Strategic Partnerships,Head of VIP & Strategic Partnerships,The Bitcoin Conference,The Bitcoin Conference,Carly Benson 是 Bitcoin Conference 的 VIP 与战略合作负责人，自 2021 年起运营 Whale Pass 体验。她在拉斯维加斯生活期间接触职业扑克与体育博彩圈，见证大额玩家如何多年使用比特币下注、结算和转账，从而在 2017 年成为一名“只持有比特币”的比特币人。在进入比特币领域之前，Carly 经营自己的市场咨询公司长达 18 年，并以“无酒精生活专家”、课程作者和瑜伽导师为人熟知，她的演讲与课程帮助成千上万人调整与酒精的关系，并曾登上《Women’s Health》《SELF》杂志、Extra TV、Travel Zoo 等媒体。,"Carly Benson is the Head of VIP & Strategic Partnerships for the Bitcoin Conference and has been running the Whale Pass experience since 2021.Carly became a Bitcoin-only Bitcoiner in 2017 after living in Las Vegas and interacting with the professional poker and sports betting community. She learned about Bitcoin by seeing use-cases for it as the whales of the gambling world have been betting, settling and transacting in BTC for many years.Before getting in to the Bitcoin space, Carly ran her own successful marketing consultancy for 18 years and was known as an alcohol-free SME, Course Creator and Yoga Instructor.She has given talks around the world and her work and courses have helped thousands change their relationship with alcohol. She’s been featured in Women’s Health, SELF magazine, Extra TV, Travel Zoo and other notable outlets.",本次 Bitcoin MENA 之行，您最希望向中东和全球比特币参与者传递的一个核心观点是什么？,"At Bitcoin MENA, what is the single core message you most want to share with bitcoin builders and investors across the region and globally?",结合您在 The Bitcoin Conference 的一线经验，过去一年中哪一个具体事件最改变您对比特币或数字资产未来的判断？,"Based on your frontline work at The Bitcoin Conference, which concrete event in the last year most changed your outlook on the future of bitcoin or digital assets?",面向 Bitcoin MENA 2025 的观众，您认为未来三年比特币在中东地区最具突破性的应用会出现在何处？,"For the Bitcoin MENA 2025 audience, where do you see the most transformative applications of bitcoin emerging across the Middle East over the next three years?",https://cdn.prod.website-files.com/687f979126432c8ce843e6d7/691d1b498552f2277f3560f8_fba248d90e04025f89ab2d2b.webp,avatars/mena-speakers/carly-b.webp
Charlene Fadirepo,Charlene Fadirepo,CEO,CEO,Mango Digital Strategies,Mango Digital Strategies,Charlene Fadirepo 是 Mango Digital Strategies 的创始人兼 CEO，这是一家专注比特币教育与咨询的公司，帮助金融专业人士和使命驱动型机构释放比特币与数字资产的潜力。凭借 15 年以上在金融、监管与创新战略方面的经验，她为企业客户提供咨询，从财务管理优化到业务实践及比特币挖矿探索。她为金融从业者打造了课程 BitcoinTreasuryCourse.com，并著有《The Bitcoin Leap: How Bitcoin Is Transforming Africa》，本科就读于弗吉尼亚大学电气工程专业，并在杜克大学富卡商学院取得 MBA。,"Charlene Fadirepo is the founder and CEO of Mango Digital Strategies, a Bitcoin education and consulting firm dedicated to helping finance professionals and mission-driven organizations unlock the potential of Bitcoin and digital assets. With 15+ years of expertise in finance, regulation, and strategic innovation, Charlene has guided corporate clients in integrating Bitcoin into their business models—whether through treasury management optimization, business practices, or exploring Bitcoin mining opportunities. Charlene is the creator of the popular course for finance professionals, BitcoinTreasuryCourse.com. Charlene is also the author of The Bitcoin Leap: How Bitcoin Is Transforming Africa. Charlene studied Electrical Engineering at the University of Virginia and earned a Masters In Business Administration from The Fuqua School of Business at Duke University.",本次 Bitcoin MENA 之行，您最希望向中东和全球比特币参与者传递的一个核心观点是什么？,"At Bitcoin MENA, what is the single core message you most want to share with bitcoin builders and investors across the region and globally?",结合您在 Mango Digital Strategies 的一线经验，过去一年中哪一个具体事件最改变您对比特币或数字资产未来的判断？,"Based on your frontline work at Mango Digital Strategies, which concrete event in the last year most changed your outlook on the future of bitcoin or digital assets?",面向 Bitcoin MENA 2025 的观众，您认为未来三年比特币在中东地区最具突破性的应用会出现在何处？,"For the Bitcoin MENA 2025 audience, where do you see the most transformative applications of bitcoin emerging across the Middle East over the next three years?",https://cdn.prod.website-files.com/687f979126432c8ce843e6d7/68eea66ebf8c5d21bce9cb43_8f759d6de48cdbdde8005707.webp,avatars/mena-speakers/charlene-fadirepo.webp
